{
  "$schema": "https://json-schema.org/draft/2020-12/schema",
  "$id": "https://maze-book.local/schemas/book.schema.json",
  "title": "Book package contract",
  "type": "object",
  "additionalProperties": false,
  "required": [
    "schemaVersion",
    "book",
    "print",
    "generation",
    "layout",
    "assets",
    "content",
    "outputs"
  ],
  "properties": {
    "schemaVersion": {
      "const": "1.0"
    },
    "extensions": {
      "type": "object"
    },
    "book": {
      "type": "object",
      "additionalProperties": false,
      "required": [
        "id",
        "title",
        "subtitle",
        "locale",
        "seed",
        "mazeCount",
        "profileId",
        "contentOrigin"
      ],
      "properties": {
        "id": {
          "type": "string",
          "pattern": "^[a-z0-9]+([-_][a-z0-9]+)*$",
          "minLength": 1,
          "maxLength": 100
        },
        "title": {
          "type": "string",
          "minLength": 1
        },
        "subtitle": {
          "type": [
            "string",
            "null"
          ]
        },
        "locale": {
          "type": "string",
          "pattern": "^[a-z]{2}(-[A-Z]{2})?$"
        },
        "seed": {
          "type": "integer",
          "minimum": 0
        },
        "seedId": {
          "description": "What maze seeds derive from, in place of book.id. Language editions of one book share a value so they print identical mazes and answer keys. Unset uses book.id.",
          "type": "string",
          "pattern": "^[a-z0-9]+([-_][a-z0-9]+)*$",
          "minLength": 1
        },
        "mazeCount": {
          "type": "integer",
          "minimum": 1,
          "maximum": 2000
        },
        "profileId": {
          "type": "string",
          "pattern": "^[a-z0-9_]+$"
        },
        "contentOrigin": {
          "type": "object",
          "additionalProperties": false,
          "required": [
            "text",
            "images",
            "translations"
          ],
          "properties": {
            "text": {
              "type": "string"
            },
            "images": {
              "type": "string"
            },
            "translations": {
              "type": "string"
            }
          }
        },
        "author": {
          "description": "Name printed on the title page and the copyright line, and used as the copyright holder.",
          "type": "string",
          "minLength": 1
        },
        "printContentOrigin": {
          "description": "Print the contentOrigin disclosure on the copyright page. KDP's own AI disclosure is made in the publishing form and is required either way; this only controls the printed page.",
          "type": "boolean"
        }
      }
    },
    "print": {
      "type": "object",
      "additionalProperties": false,
      "required": [
        "trimWidthIn",
        "trimHeightIn",
        "interiorBleed",
        "colorMode",
        "paper",
        "safeMarginsIn",
        "gutterIn"
      ],
      "properties": {
        "trimWidthIn": {
          "type": "number",
          "exclusiveMinimum": 0
        },
        "trimHeightIn": {
          "type": "number",
          "exclusiveMinimum": 0
        },
        "interiorBleed": {
          "const": false
        },
        "colorMode": {
          "enum": [
            "black-and-white"
          ]
        },
        "paper": {
          "enum": [
            "white",
            "cream"
          ]
        },
        "safeMarginsIn": {
          "type": "object",
          "additionalProperties": false,
          "required": [
            "inside",
            "outside",
            "top",
            "bottom"
          ],
          "properties": {
            "inside": {
              "type": "number",
              "minimum": 0
            },
            "outside": {
              "type": "number",
              "minimum": 0
            },
            "top": {
              "type": "number",
              "minimum": 0
            },
            "bottom": {
              "type": "number",
              "minimum": 0
            }
          }
        },
        "gutterIn": {
          "type": "number",
          "minimum": 0
        }
      }
    },
    "generation": {
      "type": "object",
      "additionalProperties": false,
      "required": [
        "startRegion",
        "finishRegion",
        "maxAttemptsPerMaze",
        "baseGenerator",
        "exactRouteEnumeration"
      ],
      "properties": {
        "endpointsOnBorder": {
          "type": "boolean"
        },
        "startRegion": {
          "$ref": "#/$defs/region"
        },
        "finishRegion": {
          "$ref": "#/$defs/region"
        },
        "maxAttemptsPerMaze": {
          "type": "integer",
          "minimum": 1,
          "maximum": 100000
        },
        "baseGenerator": {
          "type": "string",
          "minLength": 1
        },
        "exactRouteEnumeration": {
          "type": "boolean"
        }
      }
    },
    "layout": {
      "type": "object",
      "additionalProperties": false,
      "required": [
        "frontMatterPdf",
        "storyPageSide",
        "mazePageSide",
        "mazeSquareIn",
        "tallyPosition",
        "showMazeNumber",
        "showBestPossibleScore",
        "solutionsPerPage",
        "solutionsStartSide",
        "insertEndPage",
        "insertBlankPagesForParity"
      ],
      "properties": {
        "frontMatterPdf": {
          "type": [
            "string",
            "null"
          ]
        },
        "storyPageSide": {
          "enum": [
            "left",
            "right"
          ]
        },
        "mazePageSide": {
          "enum": [
            "left",
            "right"
          ]
        },
        "mazeSquareIn": {
          "type": "number",
          "exclusiveMinimum": 0
        },
        "tallyPosition": {
          "enum": [
            "below",
            "right"
          ]
        },
        "showMazeNumber": {
          "type": "boolean"
        },
        "showBestPossibleScore": {
          "type": "boolean"
        },
        "solutionsPerPage": {
          "type": "integer",
          "minimum": 1,
          "maximum": 64
        },
        "solutionsStartSide": {
          "enum": [
            "left",
            "right"
          ]
        },
        "insertEndPage": {
          "type": "boolean"
        },
        "insertBlankPagesForParity": {
          "type": "boolean"
        },
        "mazePageDecorations": {
          "type": "integer",
          "minimum": 0,
          "maximum": 4
        },
        "expectedPageCount": {
          "type": [
            "integer",
            "null"
          ],
          "minimum": 1
        }
      }
    },
    "assets": {
      "type": "object",
      "additionalProperties": false,
      "required": [
        "beginningVectorsDir",
        "endingVectorsDir",
        "deadEndVectorsDir",
        "collectibleVectorsDir",
        "pageVectorsDir",
        "startAsset",
        "finishAsset",
        "deadEndAssetPolicy",
        "collectibleAssetPolicy"
      ],
      "properties": {
        "beginningVectorsDir": {
          "$ref": "#/$defs/relPath"
        },
        "endingVectorsDir": {
          "$ref": "#/$defs/relPath"
        },
        "deadEndVectorsDir": {
          "$ref": "#/$defs/relPath"
        },
        "collectibleVectorsDir": {
          "$ref": "#/$defs/relPath"
        },
        "pageVectorsDir": {
          "oneOf": [
            {
              "$ref": "#/$defs/relPath"
            },
            {
              "type": "null"
            }
          ]
        },
        "startAsset": {
          "$ref": "#/$defs/svgName"
        },
        "finishAsset": {
          "$ref": "#/$defs/svgName"
        },
        "deadEndAssetPolicy": {
          "enum": [
            "random-from-folder",
            "first-in-folder",
            "cycle-folder"
          ]
        },
        "collectibleAssetPolicy": {
          "enum": [
            "random-from-folder",
            "first-in-folder",
            "cycle-folder"
          ]
        },
        "mazeDecorations": {
          "description": "Page-vector filenames allowed to decorate a maze page. Omit for all of them.",
          "type": "array",
          "items": {
            "type": "string",
            "minLength": 1
          }
        }
      }
    },
    "content": {
      "type": "object",
      "additionalProperties": false,
      "required": [
        "scenes",
        "endPage"
      ],
      "properties": {
        "scenes": {
          "type": "array",
          "minItems": 1,
          "items": {
            "type": "object",
            "additionalProperties": false,
            "required": [
              "number",
              "title",
              "text"
            ],
            "properties": {
              "number": {
                "type": "integer",
                "minimum": 1
              },
              "title": {
                "type": "string",
                "minLength": 1
              },
              "text": {
                "type": "string",
                "minLength": 1
              },
              "pageVector": {
                "oneOf": [
                  {
                    "$ref": "#/$defs/svgName"
                  },
                  {
                    "type": "null"
                  }
                ]
              },
              "finishVector": {
                "description": "The finish marker for this maze, from assets.endingVectorsDir: the thing the story sends the character to. Unset or null uses assets.finishAsset.",
                "oneOf": [
                  {
                    "$ref": "#/$defs/svgName"
                  },
                  {
                    "type": "null"
                  }
                ]
              }
            }
          }
        },
        "endPage": {
          "description": "Text for the optional end page (layout.insertEndPage). null uses the neutral built-in wording; the engine carries no book-specific phrasing.",
          "oneOf": [
            {
              "type": "object",
              "additionalProperties": false,
              "required": [
                "title",
                "text"
              ],
              "properties": {
                "title": {
                  "type": "string",
                  "minLength": 1
                },
                "text": {
                  "type": "string"
                }
              }
            },
            {
              "type": "null"
            }
          ]
        },
        "howToPlay": {
          "description": "Numbered instructions for the front matter's how-to-play page.",
          "type": "array",
          "items": {
            "type": "string",
            "minLength": 1
          },
          "minItems": 1,
          "maxItems": 10
        },
        "dedication": {
          "description": "Lines for the front matter's dedication page, one per printed line.",
          "type": "array",
          "items": {
            "type": "string",
            "minLength": 1
          },
          "minItems": 1,
          "maxItems": 6
        },
        "meetPage": {
          "description": "The fifth front-matter page: a short introduction to the book's character.",
          "type": "object",
          "additionalProperties": false,
          "required": [
            "title"
          ],
          "properties": {
            "title": {
              "type": "string",
              "minLength": 1
            },
            "lines": {
              "type": "array",
              "items": {
                "type": "string",
                "minLength": 1
              },
              "maxItems": 5
            }
          }
        },
        "labels": {
          "description": "Words the engine prints on every page, for books not in English. Every key is optional; an absent one keeps the English default.",
          "type": "object",
          "additionalProperties": false,
          "properties": {
            "start": {
              "type": "string",
              "minLength": 1,
              "description": "Printed under the start marker. Default START."
            },
            "finish": {
              "type": "string",
              "minLength": 1,
              "description": "Printed under the finish marker. Default FINISH."
            },
            "tallyPrompt": {
              "type": "string",
              "minLength": 1,
              "description": "Above the tick boxes. Default 'Color in one box for every candy you collect'."
            },
            "total": {
              "type": "string",
              "minLength": 1,
              "description": "Beside the Total write-in box. Default Total."
            },
            "bestPossible": {
              "description": "The score line on maze pages and answer-key captions; {n} is the number. Preflight reads the number back out of the PDF with these same templates.",
              "type": "object",
              "additionalProperties": false,
              "required": [
                "one",
                "other"
              ],
              "properties": {
                "one": {
                  "type": "string",
                  "minLength": 1,
                  "pattern": "\\{n\\}",
                  "description": "Used when the score is 1."
                },
                "other": {
                  "type": "string",
                  "minLength": 1,
                  "pattern": "\\{n\\}",
                  "description": "Used for every other score."
                }
              }
            },
            "mazeNumber": {
              "type": "string",
              "minLength": 1,
              "pattern": "\\{n\\}",
              "description": "The folio on a maze page; {n} is the maze number. Default 'Maze {n}'."
            },
            "actNames": {
              "description": "Printed band names, keyed by the profile's actName.",
              "type": "object",
              "additionalProperties": {
                "type": "string",
                "minLength": 1
              }
            },
            "howToPlayTitle": {
              "type": "string",
              "minLength": 1,
              "description": "Front matter (tools/make_front_matter.py)."
            },
            "keyCollect": {
              "type": "string",
              "minLength": 1,
              "description": "Front matter: heading over the collectible icons."
            },
            "keyScenery": {
              "type": "string",
              "minLength": 1,
              "description": "Front matter: heading over the dead-end icons."
            },
            "keyNote": {
              "type": "string",
              "minLength": 1,
              "description": "Front matter: the line under the icon key."
            },
            "copyright": {
              "type": "string",
              "minLength": 1,
              "pattern": "\\{holder\\}",
              "description": "Front matter: {year} and {holder} are filled in."
            },
            "rightsReserved": {
              "type": "string",
              "minLength": 1,
              "description": "Front matter: the line under the copyright notice."
            }
          }
        }
      }
    },
    "outputs": {
      "type": "object",
      "additionalProperties": false,
      "required": [
        "writeMazeJson",
        "writeAnalysisJson",
        "writeMazeSvg",
        "writeStandaloneMazePdf",
        "writeBookPdf",
        "writeContactSheet",
        "writePreflightReport",
        "writeEditableProofPdf"
      ],
      "properties": {
        "writeMazeJson": {
          "type": "boolean"
        },
        "writeAnalysisJson": {
          "type": "boolean"
        },
        "writeMazeSvg": {
          "type": "boolean"
        },
        "writeStandaloneMazePdf": {
          "type": "boolean"
        },
        "writeBookPdf": {
          "type": "boolean"
        },
        "writeContactSheet": {
          "type": "boolean"
        },
        "writePreflightReport": {
          "type": "boolean"
        },
        "writeEditableProofPdf": {
          "type": "boolean"
        }
      }
    },
    "cover": {
      "description": "Settings for the KDP wrap built by tools/make_cover.py. The artwork itself is not named here: the tool uses the single image in <sourceDir>/cover-front/ and <sourceDir>/cover-back/, whatever it is called. Optional: a package without it still builds an interior.",
      "type": "object",
      "additionalProperties": false,
      "properties": {
        "sourceDir": {
          "type": "string",
          "description": "Folder under input/ holding cover-front/ and cover-back/. Default: artwork."
        },
        "spineColor": {
          "type": "string",
          "pattern": "^#[0-9A-Fa-f]{6}$"
        },
        "cards": {
          "description": "The paper area of each sample card on the back-cover artwork, as [x0, y0, x1, y1] fractions of the image (y downward). Each card is whited out and a real maze from the book centred on it.",
          "type": "array",
          "items": {
            "type": "array",
            "items": {
              "type": "number",
              "minimum": 0,
              "maximum": 1
            },
            "minItems": 4,
            "maxItems": 4
          }
        },
        "samples": {
          "description": "Maze indices to print in those cards, in the same order.",
          "type": "array",
          "items": {
            "type": "integer",
            "minimum": 1
          }
        }
      }
    }
  },
  "$defs": {
    "region": {
      "type": "object",
      "additionalProperties": false,
      "required": [
        "rowMin",
        "rowMax",
        "colMin",
        "colMax"
      ],
      "properties": {
        "rowMin": {
          "type": "integer"
        },
        "rowMax": {
          "type": "integer"
        },
        "colMin": {
          "type": "integer"
        },
        "colMax": {
          "type": "integer"
        }
      }
    },
    "relPath": {
      "type": "string",
      "minLength": 1,
      "pattern": "^(?!/)(?!.*(^|/)\\.\\.(/|$)).*[^/]$"
    },
    "svgName": {
      "type": "string",
      "minLength": 5,
      "pattern": "^(?!/)(?!.*(^|/)\\.\\.(/|$))[^/]+\\.(svg|png)$"
    }
  }
}
